{
  "intent_id": "550e8400-e29b-41d4-a716-446655440000",
  "strategy_id": "s",
  "strategy_version": "1",
  "account_id": "a",
  "instrument_id": "600000.XSHG",
  "side": "BUY",
  "position_effect": "AUTO",
  "order_type": "LIMIT",
  "quantity": 100,
  "limit_price": "10.01",
  "time_in_force": "DAY",
  "signal_time": "2026-07-02T02:00:00Z",
  "market_data_version": "m1",
  "valid_until": "2026-07-02T02:00:00Z"
}
